{
  "version": 1,
  "createdBy": "signet 0.0.0-test",
  "network": {
    "passphrase": "Test SDF Network ; September 2015",
    "protocol": 28
  },
  "fork": {
    "contract": "CASFJHI5PQSRWS7JV25CF7FOMRKIVBP3RXRP3E2GH2CV4BCAG7FUJRCN",
    "ledger": 4887004,
    "consistent": false,
    "drifted": []
  },
  "ledgerInfo": {
    "sequence": 4887004,
    "timestamp": 1790458607
  },
  "configSettings": [
    {
      "key": "AAAACAAAAA8=",
      "entry": "AAAACAAAAA8AAAGQAAAAAAAAAbU=",
      "ext": "AAAAAA==",
      "lastModifiedLedgerSeq": 5194532,
      "liveUntil": null
    },
    {
      "key": "AAAACAAAAAE=",
      "entry": "AAAACAAAAAEAAAAAIpIZAAAAAAAX14QAAAAAAAAAAAMCgAAA",
      "ext": "AAAAAA==",
      "lastModifiedLedgerSeq": 5194532,
      "liveUntil": null
    },
    {
      "key": "AAAACAAAAAI=",
      "entry": "AAAACAAAAAIAAAfQAAYagAAAB9AABIgoAAAAyAADDUAAAADIAAIEAAAAAAAAAAMNAAAAAAAABOIAAAAAAAAA3wAAAADuaygA////////vZgAAAAAAAAnEAAAE4g=",
      "ext": "AAAAAA==",
      "lastModifiedLedgerSeq": 5194532,
      "liveUntil": null
    },
    {
      "key": "AAAACAAAAAM=",
      "entry": "AAAACAAAAAMAAAAAAAAH7Q==",
      "ext": "AAAAAA==",
      "lastModifiedLedgerSeq": 5194532,
      "liveUntil": null
    },
    {
      "key": "AAAACAAAAAQ=",
      "entry": "AAAACAAAAAQAAEAAAAAAAAAACcQ=",
      "ext": "AAAAAA==",
      "lastModifiedLedgerSeq": 5194532,
      "liveUntil": null
    },
    {
      "key": "AAAACAAAAAU=",
      "entry": "AAAACAAAAAUADS8AAAIEAAAAAAAAAADL",
      "ext": "AAAAAA==",
      "lastModifiedLedgerSeq": 5194532,
      "liveUntil": null
    },
    {
      "key": "AAAACAAAAAY=",
      "entry": "AAAACAAAAAYAAABWAAAAAAAAAAAAAAAEAAAAAAAAAAAAAAAAAAAAAAAAAbIAAAAAAAAAEAAAAAAAAAAAAAAAKgAAAAAAAAAQAAAAAAAAAAAAAAAsAAAAAAAAABAAAAAAAAAAAAAAAScAAAAAAAAAAAAAAAAAAAAAAAAAPAAAAAAAAAAAAAAAAAAAAAAAAADdAAAAAAAAABoAAAAAAAAAAAAAAUsAAAAAAAAREQAAAAAAAAAAAAAONAAAAAAAABtlAAAAAAAAAAAAAJ1AAAAAAAAAAAAAAAAAAAAAAAAFws8AAAAAAAAP2wAAAAAAAAAAAAZeygAAAAAAALKQAAAAAAAAAAAAAKC2AAAAAAAAAnoAAAAAAAAAAAAAB5kAAAAAAAAAAAAAAAAAAAAAAAAZUQAAAAAAABc3AAAAAAAAAAAAAALHAAAAAAAAAAAAAAAAAAAAAAAjUjQAAAAAAAAAAAAAAAAAAAAAAAAQUAAAAAAAAAAAAAAAAAAAAAAAABJsAAAAAAAAAAAAAAAAAAAAAAAAEkgAAAAAAAAAAAAAAAAAAAAAAAAQoAAAAAAAAAAAAAAAAAAAAAAAAAN0AAAAAAAAAAAAAAAAAAAAAAAABCMAAAAAAAAB9gAAAAAAAAAAAAEddQAAAAAAAGNCAAAAAAAAAAAAAAAAAAAAAAAIQFAAAAAAAAAAAAAAAAAAAAAAAAKw6wAAAAAAAAAAAAAAAAAAAAAAAHUlAAAAAAAAAAAAAAAAAAAAAAAQMkkAAAAAAAAAAAAAAAAAAAAAAAOfGAAAAAAAAAAAAAAAAAAAAAAABQMcAAAAAAAAAAAAAAAAAAAAAAAKtZUAAAAAAAAAAAAAAAAAAAAAAAaNRwAAAAAAAAAAAAAAAAAAAAAAAAAcAAAAAAAAAAAAAKgWAAAAAAAAAAAAAAAAAAAAAAAAAAAAAAAAAAAdhAAAAAAAAAAAAAAAAAAAAAAAACnXAAAAAAAAAAAAAAAAAAAAAAAADOQAAAAAAAAAAAAAAAAAAAAAAAAAAAAAAAAAAAAAAAAAAAAAAAAAAFn+AAAAAAAAAAAAAAAAAAAAAAAApfgAAAAAAAAAAAAAAAAAAAAAAAymLgAAAAAAAAAAAAAAAAAAAAAABIiMAAAAAAAAAAAAAAAAAAAAAAAAAA4AAAAAAAAAAAAAB1oAAAAAAAAAAAAAAAAAAAAAAC3KSgAAAAAAAAAAAAAAAAAAAAAAAAKVAAAAAAAAAAAAAAAAAAAAAAAAA9kAAAAAAAAAAAAAAAAAAAAAAAAHjgAAAAAAAAAAAAAAAAAAAAAACyWOAAAAAAAAAAAAAAAAAAAAAAAAFyEAAAAAAAAAAAAAAAAAAAAAABAkHgAAAAAAAAAAAAAAAAAAAAAAAWniAAAAAAAAAAAAAAAAAAAAAAABiYYAAAAAAAAAAAAAAAAAAAAAAAAeCQAAAAAAAAAAAAAAAAAAAAAAJYVpAAAAAAAAAAAAAAAAAAAAAAAj0kAAAAAABZxktgAAAAAAAAAAAA+T1QAAAAAAAAAAAAAAAAAAAAAAKEJzAAAAAAAAGpMAAAAAAAAAAAAAYncAAAAAAAAAAAAAAAAAAAAAAHgiwwAAAAAAAAAAAAAAAAAAAAAAdPEIAAAAABHL+4cAAAAAAAAAAAAcVBsAAAAAAAAAAAAAAAAAAAAAAGBdvAAAAAAAABxAAAAAAAAAAAAAoR3kAAAAACW4sQ8AAAAAAAAAAAAAB8oAAAAAAAAAAAAAAAAAAAAAAAAEgwAAAAAAAAAAAAAAAAAAAAAAAABKAAAAAAAAAAAAAAAAAAAAAAAAAUwAAAAAAAAAAAAAAAAAAAAAAAACswAAAAAAASM+AAAAAAAAAAAAAIpdAAAAAAAAAAAAAAAAAAAAAAAAAVgAAAAAAAAAAAAAAAAAAAAAAAAB3AAAAAAAAAAAAAAAAAAAAAAAAAOIAAAAAAAAAAAAAAAAAAAAAAAACvsAAAAAAAAAAAAAAAAAAAAAABoIRAAAAAAAAAAAAAAAAAAAAAAAAAA9AAAAAAAAAAAAAAAAAAAAAAAADicAAAAAAAAAAAAAAAAAAAAAABGN4wAAAAAAAAAAAAAAAAAAAAAAUFIsAAAAABdkqO4AAAAAAAAAAAAACAQAAAAAAAAAAAAAAAAAAAAAAAAEbQAAAAAAAAAAAAAAAAAAAAAAAABKAAAAAAAAAAAAAAAAAAAAAAAAAUwAAAAAAAAAAAAAAAAAAAAAAAAC8wAAAAAAAQ1CAAAAAAAAAAAAAIF/AAAAAAAAAAAAAAAAAAAAAAASFakAAAAAAnpHVA==",
      "ext": "AAAAAA==",
      "lastModifiedLedgerSeq": 2070825,
      "liveUntil": null
    },
    {
      "key": "AAAACAAAAAc=",
      "entry": "AAAACAAAAAcAAABWAAAAAAAAAAAAAAAAAAAAAAAAAAAAAAAAAAAAAAAAABAAAAAAAAAAgAAAAAAAAAAAAAAAAAAAAAAAAAAAAAAAAAAAAAAAAAAAAAAAAAAAAAAAAAAAAAAAAAAAAAAAAAAAAAAAAAAAAAAAAAAAAAAAAAAAAAAAAAAAAAAAAAAAAAAAAADyAAAAAAAAAYAAAAAAAAAAAAAAAAAAAAAAAAABgAAAAAAAAAAAAAAAAAAAAAAAAAAAAAAAAAAAAAAAAAAAAAAAAAAAAAAAAAAAAAAAAAAAAAAAAAAAAAAAAAAAAAAAAAAAAAIGpQAAAAAAABMnAAAAAAAAAAAAAQ9gAAAAAAAABMEAAAAAAAAAAAAAAA4AAAAAAAAAAAAAAAAAAAAAAAAAAAAAAAAAAAAAAAAAAAAAAAAAAAAAAAAAAAAAAAAAAAAAAAAAAAAAALUAAAAAAAAAAAAAAAAAAAAAAAAAYwAAAAAAAAAAAAAAAAAAAAAAAABjAAAAAAAAAAAAAAAAAAAAAAAAAGMAAAAAAAAAAAAAAAAAAAAAAAAAYwAAAAAAAAAAAAAAAAAAAAAAAABjAAAAAAAAAAAAAAAAAAAAAAAAAAAAAAAAAAAAAAAAAAAAAAAAAABEnAAAAAAAABk5AAAAAAAAAAAAAAAAAAAAAAAAuWgAAAAAAAAAAAAAAAAAAAAAAAA0bAAAAAAAAAAAAAAAAAAAAAAAABiNAAAAAAAAAAAAAAAAAAAAAAAA/J4AAAAAAAAAAAAAAAAAAAAAAABxkgAAAAAAAAAAAAAAAAAAAAAAALvfAAAAAAAAAAAAAAAAAAAAAAABkz0AAAAAAAAAAAAAAAAAAAAAAACOKgAAAAAAAAAAAAAAAAAAAAAAAAEBAAAAAAAAAAAAARQwAAAAAAAAAAAAAAAAAAAAAAAAAAAAAAAAAAA5FQAAAAAAAAAAAAAAAAAAAAAAABqxAAAAAAAAAAAAAAAAAAAAAAAABAEAAAAAAAAAAAAAAAAAAAAAAAAAAAAAAAAAAAAAAAAAAAAAAAAAAfpgAAAAAAAAAAAAAAAAAAAAAAAANWEAAAAAAAAAAAAAAAAAAAAAAAF9ZQAAAAAAAAAAAAAAAAAAAAAAACPYAAAAAAAAAAAAAAAAAAAAAAAAAH4AAAAAAAAAAAAAAAAAAAAAAAAAAAAAAAAAAAAAAAAAAAAAAAAAAAAAAAAAAAAAAAAAAAAAAAAAAAAAAAAAAAAAAAAAAAAAAAAAAAAAAAAAAAAAAAAAAAAAAAAAAAAAAAAAAAAAAAAAAAAAAAAAAAAAAAAAAAAAAAAAAAAAAAAAAAAAAAAAAAAAAAAAAAAAAAAAAAAAAAAAAAAAAAAAAAAAAAAAAAAAAAAAAAAAAAAAAAAAAAAAAAAAAAAAAAAAAAAAAAAAAAAAAAAAAAAAAAAAAAAAAAAAAAAAAAAAAAAAAAAAAAAAAAAAAAAAAAAAAAAAAAAAAAAAAAABq7YAAAAAAAQRawAAAAAAAAAAAAAK2AAAAAAAAAAAAAAAAAAAAAAAABcIAAAAAAAAAAAAAAAAAAAAAAAAAAAAAAAAAAAAAAAAAAAAAAAAAAAAAAAAAAAAAAAAAAAAAAAAAAAAA1oGAAAAAAAEEWsAAAAAAAAAAAAABogAAAAAAAAAAAAAAAAAAAAAAAAPeAAAAAAAAAAAAAAAAAAAAAAAAAicAAAAAACOhjoAAAAAAAAAAAAAAAAAAAAAAAAAAAAAAAAAAAAAAAAA+AAAAAAAAAAAAAAAAAAAAAAAAAAAAAAAAAAAAAAAAAAAAAAAAAAAAAAAAAAAAAAAAAAAAAAAAAAAAAAAAAAAAAAAAACAAAAAAAAAAAAAAAAAAAAAAAAAAAAAAAAAAAAAAAAAAAAAAAAAAAAAAAAAAAAAAAAAAAAAAAAAAAAAAAAAAAAAAAAAAAAAAAAAAAAAAAAAAAAAAAAAAAAAAAAAAAAAAAAAAAAAAAAAAAAAAAAAAAAAAAAAAAAAAAAAAAAAAAAAAAAAAAAAAAAAAAAAAAAAAAAAAAAAAAAAAAAAAAAAAAAAAAAAAAAAAAAAAAAAAAAAAAAAAAAAAAAAAAAAAAAAAAcdAAAAAABfGeIAAAAAAAAAAAAAAAAAAAAAAAAAAAAAAAAAAAAAAAABOAAAAAAAAAAAAAAAAAAAAAAAAAAAAAAAAAAAAAAAAAAAAAAAAAAAAAAAAAAAAAAAAAAAAAAAAAAAAAAAAAAAAAAAAAAAAAAAAAAAAAAAAAAAAAAAAAAAAAAAAAAAAAAAAAABHWUAAAAAAAOBkw==",
      "ext": "AAAAAA==",
      "lastModifiedLedgerSeq": 2070825,
      "liveUntil": null
    },
    {
      "key": "AAAACAAAAAo=",
      "entry": "AAAACAAAAAoAL3YAAAAC0AAB2IAAAAAAAAAEvwAAAAAAAAl+AAAD6AAAAB4AAABAAAehIAAAAAc=",
      "ext": "AAAAAA==",
      "lastModifiedLedgerSeq": 2332,
      "liveUntil": null
    },
    {
      "key": "AAAACAAAAAw=",
      "entry": "AAAACAAAAAwAAAAeAAAAAO5Zv2sAAAAA7lp1vwAAAADuWy43AAAAAO5g+JsAAAAA7mGkZwAAAADudCncAAAAAO6BrOsAAAAA7oKtZwAAAADujjhqAAAAAO6PcWEAAAAA7o/vhQAAAADukHfpAAAAAO6Q8U0AAAAA7pF1gQAAAADukni5AAAAAO6qTAYAAAAA7qryQgAAAADuq+RWAAAAAO6sXqYAAAAA7q1QowAAAADuroRbAAAAAO60H8QAAAAA7toj/AAAAADu3fmnAAAAAO7e50sAAAAA7tI29AAAAADuwUMnAAAAAO6we7gAAAAA7qCILQAAAADutG3H",
      "ext": "AAAAAA==",
      "lastModifiedLedgerSeq": 5370048,
      "liveUntil": null
    }
  ],
  "entries": [
    {
      "key": "AAAAB5NplsdLfTg8VuwXSFexWSfN0pR4xpCdozK03si2czX+",